{"$schema":"https://json-schema.org/draft/2020-12/schema","$id":"https://coh.invalid/contracts/kusto-validator/v1/semantic-registry.schema.json","title":"COH Kusto semantic registry","type":"object","additionalProperties":false,"required":["schema_version","contract_version","validator_version","allowed_operators","allowed_functions","allowed_aggregates","prohibited_constructs","stored_functions_allowed","evaluate_allowed","external_data_allowed","cross_cluster_allowed","dynamic_output_allowed","digest"],"properties":{"schema_version":{"const":"coh.kusto-semantic-registry/v1"},"contract_version":{"const":"1.0.0"},"validator_version":{"const":"kusto-language-12.4.1-coh-1.0.0"},"allowed_operators":{"$ref":"#/$defs/tokens"},"allowed_functions":{"$ref":"#/$defs/tokens"},"allowed_aggregates":{"$ref":"#/$defs/tokens"},"prohibited_constructs":{"$ref":"#/$defs/tokens"},"stored_functions_allowed":{"const":false},"evaluate_allowed":{"const":false},"external_data_allowed":{"const":false},"cross_cluster_allowed":{"const":false},"dynamic_output_allowed":{"const":false},"digest":{"$ref":"#/$defs/digest"}},"$defs":{"token":{"type":"string","pattern":"^[a-z][a-z0-9_.-]{0,127}$"},"tokens":{"type":"array","minItems":1,"maxItems":256,"uniqueItems":true,"items":{"$ref":"#/$defs/token"}},"digest":{"type":"string","pattern":"^sha256:[0-9a-f]{64}$"}}}
