{"schema_version":"coh.kusto-semantic-registry/v1","contract_version":"1.0.0","validator_version":"kusto-language-12.4.1-coh-1.0.0","allowed_operators":["count","distinct","extend","filter","limit","order","parse","parse-where","project","project-away","project-keep","project-rename","sort","summarize","take","top","union","where"],"allowed_functions":["abs","bin","case","coalesce","endofday","endofmonth","endofweek","format_datetime","getmonth","getyear","iff","indexof","ipv4_compare","ipv4_is_in_range","isascii","isempty","isfinite","isinf","isnan","isnotempty","isnotnull","isnull","log","max_of","min_of","round","startofday","startofmonth","startofweek","strcat","strcmp","strlen","substring","tobool","todatetime","todecimal","todouble","toint","tolong","tolower","toreal","tostring","totimespan","toupper","trim","trim_end","trim_start"],"allowed_aggregates":["avg","avgif","count","countif","dcount","dcountif","max","min","sum","sumif"],"prohibited_constructs":["control_command","cross_cluster","cross_database","datatable","dynamic_output","entity_group","evaluate","execute","external_data","external_table","fuzzy_union","getschema","invoke","let_statement","macro_expand","materialized_view","query_parameters","restrict_statement","set_statement","stored_function","stored_query_result","wildcard_union"],"stored_functions_allowed":false,"evaluate_allowed":false,"external_data_allowed":false,"cross_cluster_allowed":false,"dynamic_output_allowed":false,"digest":"sha256:4b01ac2f77f54138c0a9b5fdab1a5a9195f147804aac44884e03860a83ee6f52"}
